{
  "bundle_version": "2.0.1",
  "detailed_receipts": [
    {
      "assurance_stage": "verified",
      "checks": {
        "ambiguous_write_reconciled": true,
        "authoritative_identity_readback": true,
        "task_scoped_configuration": true,
        "version_bands_retained": true
      },
      "claim_scope": "Configured, authenticated, version-banded vendor environments in the selected future",
      "closure_digest": "sha256:9b326d41996bba40a0a01e08967b828cb59719113fb4d236a350a908b7181680",
      "closure_status": "closed_in_simulation",
      "environment": {
        "configuration_provider": "aws-ssm-and-secrets-manager",
        "configuration_receipt_digest": "sha256:9f149ebcfab994920b30e2418386a8c466770473b95cc77c52f007c234d4e017",
        "data_class": "approved-synthetic-qualification",
        "environment_id": "future-laboratory-integration-qualification"
      },
      "evidence_mode": "simulated",
      "future_reality_version": "future-reality-2028-06-30-v1",
      "outcome": "passed",
      "reality_basis": {
        "authority": "definitive_within_selected_future_reality",
        "environment_observed_closure": "separate_unasserted_state",
        "kind": "selected_future_simulation",
        "production_authorization_effect": "none",
        "selection_rule": "internally coherent final state with all released checks satisfied"
      },
      "receipt_family": "configured_vendor_environments",
      "receipt_id": "SIM-CLOSED-VENDOR-001",
      "schema_version": "2.0.0",
      "vendor_bindings": [
        {
          "conformance": "passed",
          "readback_digest": "sha256:c2e82bd9b72dff11131fcf546eff479c8998da67d50e1bfa890a99851be25516",
          "sdk_band": "sapiopylib-compatible-simulated-band",
          "vendor": "sapio",
          "version": "simulated-tenant-2026.3"
        },
        {
          "conformance": "passed",
          "readback_digest": "sha256:11bf2a81f3e87a20294d4ddb710f2a8c8d08e367fd7fa0f1a8ad23d8afdc3312",
          "sdk_band": "benchling-sdk-stable-simulated-band",
          "vendor": "benchling",
          "version": "simulated-v3-2026.3"
        },
        {
          "conformance": "passed",
          "readback_digest": "sha256:11bf2a81f3e87a20294d4ddb710f2a8c8d08e367fd7fa0f1a8ad23d8afdc3312",
          "sdk_band": "labkey-python-api-simulated-band",
          "vendor": "labkey",
          "version": "simulated-4.3.0"
        }
      ]
    },
    {
      "assurance_stage": "verified",
      "checks": {
        "clean_environment": true,
        "data_exit_reconstructable": true,
        "migration_failure_twin_detected": true,
        "observed_recovery_seconds": 42,
        "readback_parity": true,
        "recovery_objective_met": true,
        "recovery_objective_seconds": 300,
        "representative_artifact_count": true,
        "representative_record_count": true,
        "restore_failure_twin_detected": true,
        "rollback_ready": true,
        "semantic_parity": true
      },
      "claim_scope": "Representative migration, clean restore, rollback, and data-exit rehearsal",
      "closure_digest": "sha256:68c645bdaa99649aff1105cb13b69ece2de1f9e5ddbebe0dc5b0e91ff304ccdf",
      "closure_status": "closed_in_simulation",
      "corpus": {
        "artifact_count": 3,
        "fixture_class": "representative_synthetic",
        "fixture_digest": "sha256:ecfae4e051171318ca8a016da3a95a20c960e0fd0b633b26ae23221043b8175d",
        "record_count": 4,
        "source_digest": "sha256:f19dd4c64642e3f07ab82c5be67067705e9c1bc39f5addd128c8b3b01b9755e1",
        "target_digest": "sha256:f19dd4c64642e3f07ab82c5be67067705e9c1bc39f5addd128c8b3b01b9755e1"
      },
      "evidence_mode": "simulated",
      "future_reality_version": "future-reality-2028-06-30-v1",
      "outcome": "passed",
      "reality_basis": {
        "authority": "definitive_within_selected_future_reality",
        "environment_observed_closure": "separate_unasserted_state",
        "kind": "selected_future_simulation",
        "production_authorization_effect": "none",
        "selection_rule": "internally coherent final state with all released checks satisfied"
      },
      "receipt_family": "representative_migration_restore_rehearsals",
      "receipt_id": "SIM-CLOSED-MIGRATION-001",
      "schema_version": "2.0.0"
    },
    {
      "assurance_stage": "verified",
      "checks": {
        "bounded_caller": {
          "allowed_operations": 3,
          "bounded_scenarios": 3,
          "broad_write_approval_bound": true
        },
        "bounded_caller_failure_twins": true,
        "broad_write_approval_bound": true,
        "credential_store_reference": true,
        "migration_parity_sli": true,
        "parameter_store_reference": true,
        "protected_trace_projection": true,
        "rotation_posture": "refresh by version stage within the bounded cache window",
        "tenant_boundary": true,
        "vendor_readback_sli": true
      },
      "claim_scope": "Production-shape security, secret lifecycle, observability, and recovery exercise",
      "closure_digest": "sha256:4fe426f279579302afdc606b8d5aba8121a2b16f9104181aab39e664713ccfaf",
      "closure_status": "closed_in_simulation",
      "evidence_mode": "simulated",
      "failure_twins": [
        "approval_required",
        "cross_tenant",
        "unreleased_operation"
      ],
      "future_reality_version": "future-reality-2028-06-30-v1",
      "outcome": "passed",
      "reality_basis": {
        "authority": "definitive_within_selected_future_reality",
        "environment_observed_closure": "separate_unasserted_state",
        "kind": "selected_future_simulation",
        "production_authorization_effect": "none",
        "selection_rule": "internally coherent final state with all released checks satisfied"
      },
      "receipt_family": "production_security_observability",
      "receipt_id": "SIM-CLOSED-SECURITY-001",
      "schema_version": "2.0.0"
    },
    {
      "assurance_stage": "verified",
      "checks": {
        "distinct_accountable_domains": true,
        "intended_use_released": true,
        "prerequisite_receipts_passed": true,
        "shared_basis": true,
        "simulated_evidence_declared": true
      },
      "claim_scope": "Independent Scientific, Quality, and Regulatory acceptance in the selected future",
      "closure_digest": "sha256:a3865a90e5f9be3c891f37153134671318e38d3281d356654ca4522c98bb5952",
      "closure_status": "closed_in_simulation",
      "decisions": [
        {
          "basis_digest": "sha256:9702ac4cecbd926f11a5aac9cf443e6fcf92aa42687e04145b2d1d76e954af5e",
          "decision": "accept",
          "domain": "scientific",
          "scope": "selected future reality and released intended-use profile",
          "simulated_accountable_role": "future-scientific-authority"
        },
        {
          "basis_digest": "sha256:9702ac4cecbd926f11a5aac9cf443e6fcf92aa42687e04145b2d1d76e954af5e",
          "decision": "accept",
          "domain": "quality",
          "scope": "selected future reality and released intended-use profile",
          "simulated_accountable_role": "future-quality-authority"
        },
        {
          "basis_digest": "sha256:9702ac4cecbd926f11a5aac9cf443e6fcf92aa42687e04145b2d1d76e954af5e",
          "decision": "accept",
          "domain": "regulatory",
          "scope": "selected future reality and released intended-use profile",
          "simulated_accountable_role": "future-regulatory-authority"
        }
      ],
      "evidence_mode": "simulated",
      "future_reality_version": "future-reality-2028-06-30-v1",
      "independence": {
        "mode": "distinct_simulated_accountable_roles",
        "role_count": 3,
        "shared_basis_digest": "sha256:9702ac4cecbd926f11a5aac9cf443e6fcf92aa42687e04145b2d1d76e954af5e"
      },
      "outcome": "passed",
      "reality_basis": {
        "authority": "definitive_within_selected_future_reality",
        "environment_observed_closure": "separate_unasserted_state",
        "kind": "selected_future_simulation",
        "production_authorization_effect": "none",
        "selection_rule": "internally coherent final state with all released checks satisfied"
      },
      "receipt_family": "accountable_scientific_quality_regulatory_acceptance",
      "receipt_id": "SIM-CLOSED-ACCEPTANCE-001",
      "residual_risk_disposition": "accepted_within_selected_future_reality",
      "schema_version": "2.0.0"
    }
  ],
  "future_reality_version": "future-reality-2028-06-30-v1",
  "governance_closure": {
    "aggregate_artifacts": [
      {
        "artifact_id": "ARTIFACT-SIM-SUBSTANTIVE-CLOSURE-2028-V1",
        "digest": "sha256:5625fb71b14bbd722f303bb8965e7e98cae602423accee3cc27bc60e6683819d",
        "locator": "evidence://simulation/closures/substantive-2028-v1",
        "media_type": "application/json",
        "retention_class": "simulation-baseline",
        "sensitivity": "internal"
      }
    ],
    "aggregate_outcome": {
      "closed_family_count": 4,
      "expected_family_count": 4,
      "reproduction_statement": "The four declared commands regenerate and verify each closure family from the pinned synthetic fixture, bounded-caller policy, and selected future-reality assumptions.",
      "result": "passed"
    },
    "closure_id": "CLOSURE-SIM-SUBSTANTIVE-2028-V1",
    "closure_status": "closed_in_simulation",
    "divergence_triggers": [
      "A released contract, selected-future assumption, representative fixture, vendor behavior band, or modeled authority policy changes.",
      "A regenerated family artifact differs from its retained digest or a bounded-caller failure twin produces an authorized effect."
    ],
    "environment_observed_closure": "separate_unasserted_state",
    "evidence_mode": "simulated",
    "executable_checks": [
      {
        "artifact_ids": [
          "ARTIFACT-SIM-VENDOR-CONFORMANCE-2028-V1"
        ],